{
  "domain": "Deals",
  "nodes": [
    {
      "id": "Commercial Items Master",
      "modifies": false
    },
    {
      "id": "Deals Master",
      "modifies": false
    },
    {
      "id": "JPharm",
      "modifies": false
    },
    {
      "id": "CMS",
      "modifies": false
    },
    {
      "id": "Databricks",
      "modifies": false
    },
    {
      "id": "CI",
      "modifies": false
    },
    {
      "id": "CDDI",
      "modifies": false
    },
    {
      "id": "CDI",
      "modifies": false
    }
  ],
  "edges": [
    {
      "source": "Commercial Items Master",
      "target": "Deals Master"
    },
    {
      "source": "Deals Master",
      "target": "JPharm"
    },
    {
      "source": "Deals Master",
      "target": "CMS"
    },
    {
      "source": "Deals Master",
      "target": "Databricks"
    },
    {
      "source": "JPharm",
      "target": "CI"
    },
    {
      "source": "JPharm",
      "target": "CDI"
    },
    {
      "source": "CMS",
      "target": "CDDI"
    }
  ],
  "initialization": {
    "services": ["Commercial Items Master"]
  }
}